{
  "$schema": "../../schemas/preset.schema.json",
  "id": "eu-built-in-composite",
  "name": "Europe - Composite conique conforme",
  "description": "Vue composite de l'Europe en projection conique conforme",
  "atlasId": "eu",
  "type": "built-in-composite",
  "config": {
    "projectionId": "conic-conformal-europe",
    "globalScale": 1.0
  }
}
